{
  "schemaVersion": "1.0.0",
  "id": "lex-de-flughafen",
  "languageId": "de",
  "type": "word",
  "surface": "Flughafen",
  "lemma": "Flughafen",
  "partOfSpeech": "noun",
  "partOfSpeechFa": "اسم",
  "level": "A1",
  "translationFa": "فرودگاه",
  "usageNoteFa": "از مقصدهای پرتکرار بخش مسیرهاست.",
  "grammarNoteRefs": [],
  "exampleRefs": [],
  "sourceRefs": [
    "src-wikivoyage-german-phrasebook-directions"
  ],
  "formRefs": [],
  "flashcardEligible": true,
  "audioStatus": "pending",
  "audioRef": null,
  "audioVoice": null
}
