{
  "schemaVersion": "1.0.0",
  "id": "lex-de-nachmittag",
  "languageId": "de",
  "type": "word",
  "surface": "Nachmittag",
  "lemma": "Nachmittag",
  "partOfSpeech": "noun",
  "partOfSpeechFa": "اسم",
  "level": "A1",
  "translationFa": "بعدازظهر",
  "usageNoteFa": "در پیام تماس برای تعیین زمان تماس دوباره استفاده می‌شود.",
  "grammarNoteRefs": [],
  "exampleRefs": [],
  "sourceRefs": [
    "src-wikibooks-de-lesson-024-short-messages"
  ],
  "formRefs": [],
  "flashcardEligible": true,
  "audioStatus": "pending",
  "audioRef": null,
  "audioVoice": null
}
