{
  "schemaVersion": "1.0.0",
  "id": "lex-de-zimmer",
  "languageId": "de",
  "type": "word",
  "surface": "Zimmer",
  "lemma": "Zimmer",
  "partOfSpeech": "noun",
  "partOfSpeechFa": "اسم",
  "level": "A1",
  "translationFa": "اتاق",
  "usageNoteFa": "برای اشاره به یک اتاق در محل زندگی یا ساختمان استفاده می‌شود.",
  "grammarNoteRefs": [],
  "exampleRefs": [],
  "sourceRefs": [
    "src-wikibooks-de-lesson-007-room-objects"
  ],
  "formRefs": [],
  "flashcardEligible": true,
  "audioStatus": "ready",
  "audioRef": null,
  "audioVoice": null
}
