{
  "schemaVersion": "1.0.0",
  "id": "lex-de-polizist",
  "languageId": "de",
  "type": "word",
  "surface": "Polizist",
  "lemma": "Polizist",
  "partOfSpeech": "noun",
  "partOfSpeechFa": "اسم",
  "level": "A1",
  "translationFa": "پلیس مرد",
  "usageNoteFa": "در بخش منبع‌دار شغل‌ها برای معرفی یک پلیس مرد استفاده می‌شود.",
  "grammarNoteRefs": [],
  "exampleRefs": [],
  "sourceRefs": [
    "src-wikibooks-de-lesson-002-professions"
  ],
  "formRefs": [],
  "flashcardEligible": true,
  "audioStatus": "pending",
  "audioRef": null,
  "audioVoice": null
}
