{
  "schemaVersion": "1.0.0",
  "id": "lex-de-bis",
  "languageId": "de",
  "type": "word",
  "surface": "bis",
  "lemma": "bis",
  "partOfSpeech": "preposition",
  "partOfSpeechFa": "حرف اضافه",
  "level": "A1",
  "translationFa": "تا",
  "usageNoteFa": "برای بیان پایان یک بازه یا ماندن تا زمان مشخص استفاده می‌شود.",
  "grammarNoteRefs": [],
  "exampleRefs": [],
  "sourceRefs": [
    "src-wikibooks-de-lesson-021-time-appointment"
  ],
  "formRefs": [],
  "flashcardEligible": true,
  "audioStatus": "ready",
  "audioRef": null,
  "audioVoice": null
}
