{
  "schemaVersion": "1.0.0",
  "id": "lex-de-kuchen",
  "languageId": "de",
  "type": "word",
  "surface": "Kuchen",
  "lemma": "Kuchen",
  "partOfSpeech": "noun",
  "partOfSpeechFa": "اسم",
  "level": "A1",
  "translationFa": "کیک",
  "usageNoteFa": "در سفارش کافه برای درخواست یک یا چند تکه کیک استفاده می‌شود.",
  "grammarNoteRefs": [],
  "exampleRefs": [],
  "sourceRefs": [
    "src-wikibooks-de-lesson-007-food-order"
  ],
  "formRefs": [],
  "flashcardEligible": true,
  "audioStatus": "ready",
  "audioRef": null,
  "audioVoice": null
}
