{
  "schemaVersion": "1.0.0",
  "id": "lex-de-bezahlen",
  "languageId": "de",
  "type": "word",
  "surface": "bezahlen",
  "lemma": "bezahlen",
  "partOfSpeech": "verb",
  "partOfSpeechFa": "فعل",
  "level": "A1",
  "translationFa": "پرداخت کردن",
  "usageNoteFa": "برای گفتن یا فهمیدن مرحلهٔ پرداخت در خرید استفاده می‌شود.",
  "grammarNoteRefs": [],
  "exampleRefs": [],
  "sourceRefs": [
    "src-wikibooks-de-lesson-009-shopping"
  ],
  "formRefs": [],
  "flashcardEligible": true,
  "audioStatus": "ready",
  "audioRef": null,
  "audioVoice": null
}
