{
  "schemaVersion": "1.0.0",
  "id": "lex-de-deutschland",
  "languageId": "de",
  "type": "word",
  "surface": "Deutschland",
  "lemma": "Deutschland",
  "partOfSpeech": "proper_noun",
  "level": "Pre-A1",
  "translationFa": "آلمان",
  "usageNoteFa": null,
  "grammarNoteRefs": [],
  "exampleRefs": [],
  "sourceRefs": [
    "src-wikibooks-de-residence-origin"
  ],
  "formRefs": [],
  "flashcardEligible": true,
  "audioStatus": "ready",
  "audioRef": null,
  "audioVoice": null,
  "partOfSpeechFa": "اسم خاص"
}
