{"schemaVersion":"1.0.0","id":"lex-de-hose","languageId":"de","type":"word","surface":"Hose","lemma":"Hose","partOfSpeech":"noun","level":"Pre-A1","translationFa":"شلوار","usageNoteFa":null,"grammarNoteRefs":[],"exampleRefs":[],"sourceRefs":["src-wikibooks-de-lesson-004"],"formRefs":[],"flashcardEligible":true,"audioStatus":"pending","audioRef":null,"audioVoice":null,"partOfSpeechFa":"اسم"}
