{"schemaVersion":"1.0.0","id":"lex-de-schuhe","languageId":"de","type":"word","surface":"Schuhe","lemma":"Schuh","partOfSpeech":"noun","level":"Pre-A1","translationFa":"کفش‌ها / یک جفت کفش","usageNoteFa":"در جملهٔ منبع به‌صورت جمع «Schuhe» آمده است.","grammarNoteRefs":[],"exampleRefs":[],"sourceRefs":["src-wikibooks-de-lesson-004"],"formRefs":[],"flashcardEligible":true,"audioStatus":"pending","audioRef":null,"audioVoice":null,"partOfSpeechFa":"اسم"}
