{
  "schemaVersion": "1.0.0",
  "id": "lex-de-arbeiten",
  "languageId": "de",
  "type": "word",
  "surface": "arbeiten",
  "lemma": "arbeiten",
  "partOfSpeech": "verb",
  "partOfSpeechFa": "فعل",
  "level": "A1",
  "translationFa": "کار کردن",
  "usageNoteFa": "برای گفتن محل یا نوع کار در معرفی ساده استفاده می‌شود.",
  "grammarNoteRefs": [],
  "exampleRefs": [],
  "sourceRefs": [
    "src-wikibooks-bll-a1-lesson-1",
    "src-wikibooks-bll-a1-lesson-2"
  ],
  "formRefs": [
    "lexform-de-arbeiten-arbeite"
  ],
  "flashcardEligible": true,
  "audioStatus": "ready",
  "audioRef": null,
  "audioVoice": null
}
