{
  "schemaVersion": "1.0.0",
  "id": "lex-de-cent",
  "languageId": "de",
  "type": "word",
  "surface": "Cent",
  "lemma": "Cent",
  "partOfSpeech": "noun",
  "level": "Pre-A1",
  "translationFa": "سِنت",
  "usageNoteFa": "در قیمت‌های ساده همراه «Euro» به کار می‌رود.",
  "grammarNoteRefs": [],
  "exampleRefs": [],
  "sourceRefs": ["src-wikibooks-de-lesson-004"],
  "formRefs": [],
  "flashcardEligible": true,
  "audioStatus": "pending",
  "audioRef": null,
  "audioVoice": null,
  "partOfSpeechFa": "اسم"
}
