{
  "schemaVersion": "1.0.0",
  "id": "lex-de-kino",
  "languageId": "de",
  "type": "word",
  "surface": "Kino",
  "lemma": "Kino",
  "partOfSpeech": "noun",
  "partOfSpeechFa": "اسم",
  "level": "A1",
  "translationFa": "سینما",
  "usageNoteFa": "در نمونه‌های قرار و انتظار در یک مکان مشخص استفاده می‌شود.",
  "grammarNoteRefs": [],
  "exampleRefs": [],
  "sourceRefs": [
    "src-wikibooks-de-lesson-021-time-appointment"
  ],
  "formRefs": [],
  "flashcardEligible": true,
  "audioStatus": "ready",
  "audioRef": null,
  "audioVoice": null
}
