{
  "schemaVersion": "1.0.0",
  "id": "lex-de-bruder",
  "languageId": "de",
  "type": "word",
  "surface": "Bruder",
  "lemma": "Bruder",
  "partOfSpeech": "noun",
  "partOfSpeechFa": "اسم",
  "level": "A1",
  "translationFa": "برادر",
  "usageNoteFa": "برای اشاره به برادر در گفت‌وگوهای سادهٔ خانوادگی استفاده می‌شود.",
  "grammarNoteRefs": [],
  "exampleRefs": [],
  "sourceRefs": [
    "src-wikibooks-de-lesson-007-family"
  ],
  "formRefs": [],
  "flashcardEligible": true,
  "audioStatus": "ready",
  "audioRef": null,
  "audioVoice": null
}
