{
  "schemaVersion": "1.0.0",
  "id": "lex-de-links",
  "languageId": "de",
  "type": "word",
  "surface": "links",
  "lemma": "links",
  "partOfSpeech": "adverb",
  "partOfSpeechFa": "قید",
  "level": "A1",
  "translationFa": "سمت چپ / در سمت چپ",
  "usageNoteFa": "برای بیان موقعیت ساده در محیط نزدیک استفاده می‌شود.",
  "grammarNoteRefs": [],
  "exampleRefs": [],
  "sourceRefs": [
    "src-wikibooks-de-lesson-009-room-position"
  ],
  "formRefs": [],
  "flashcardEligible": true,
  "audioStatus": "pending",
  "audioRef": null,
  "audioVoice": null
}
