{
  "schemaVersion": "1.0.0",
  "id": "lex-de-journalist",
  "languageId": "de",
  "type": "word",
  "surface": "Journalist",
  "lemma": "Journalist",
  "partOfSpeech": "noun",
  "partOfSpeechFa": "اسم",
  "level": "A1",
  "translationFa": "روزنامه‌نگار مرد",
  "usageNoteFa": "در پاسخ منبع‌دار «Nein, ich arbeite als Journalist.» به‌عنوان شغل آمده است.",
  "grammarNoteRefs": [],
  "exampleRefs": [],
  "sourceRefs": [
    "src-wikibooks-bll-a1-lesson-2"
  ],
  "formRefs": [],
  "flashcardEligible": true,
  "audioStatus": "ready",
  "audioRef": null,
  "audioVoice": null
}
